{
  "$schema": "../../../schemas/variant.schema.json",
  "variantId": "primary-hand",
  "label": "Primary hand",
  "unityType": "Ardenfall.Item.PrimaryHandItemData",
  "canonicalTable": "item_primary_hand_items",
  "parentVariantId": "hand-item",
  "position": 30,
  "fields": [
    {
      "name": "twoHanded",
      "type": "boolean",
      "from": "twoHanded.Get()",
      "missingPolicy": "diagnostic"
    }
  ]
}
